{"entries":[{"compatibilityKey":"sha256:8d1dd12b458da77b329e68d6e96645ed2e0618ef7645900d72b85a54c662ff15","manifestSha256":"410604b74cd55528842050c2a2246eb1e1187c4563575441a65e66e2472d5cc6","query":"example run store query","runId":"2026-10-18-example-run-store-query-22222222222222222222222222222222","sequence":2,"startedUtc":"2026-10-18T12:00:00.000Z"}],"namespaceId":"0123456789abcdef0123456789abcdef","schema":"intelli-v1/index","schemaVersion":1}
